{"admission_policy":{"category_mapping_requirements":["Use the exact registered source ID, source version or date, verification status and verification date from the sealed baseline context.","Identify a precise article, paragraph, clause, annex, numbered section, principle or control; generic thematic locators are prohibited.","State the category-specific supported claim, relationship, mapping rationale, applicability conditions and exclusions.","Do not infer compliance, control satisfaction, legal applicability or decision authority from source registration or domain coverage.","Do not combine multiple instruments, publications or mutable collections behind one source ID."],"decision_eligible_requirements":["The register and approval record are APPROVED and the source record is VERIFIED.","The record identifies one stable instrument or publication with an official publisher location, exact edition or date, authority tier, authority type and applicability conditions.","The source is in force or published and is not a draft, proposal, collection page, mutable topic page, withdrawn, superseded or under development.","VERIFIED means source governance checked the publisher, title, instrument or publication identifier, version or date, publication or legal status, canonical location, authority classification and licensing boundary—not only URL reachability.","Licensed standards remain metadata- and locator-only unless separate, explicit usage rights permit storage or transmission of protected content.","A VERIFIED record may be used only within its stated authority boundary and never substitutes for assessment-time applicability or interpretation."]},"approval_record":{"approval_scope":"GLOBAL_SOURCE_IDENTITY_AND_DOMAIN_AUTHORITY_A_F","approval_status":"APPROVED","approved_by_role":"AI_GOVERNANCE_OWNER","approved_on":"2026-08-18","authority_statement":"Approved as the governed source identity, authority-classification, provenance and A–F domain-coverage register for baseline composition. Approval does not establish case-specific legal applicability, legal interpretation, compliance, control satisfaction, residual-risk acceptance or lifecycle authorization.","change_control":"Never overwrite this approved artifact. A source identity, edition, status, official location, authority classification, licensing boundary or coverage change requires a successor semantic version, source-governance verification, renewed approval, dependency revalidation and a newly sealed baseline. Existing runs remain bound to their original register version and hash.","effective_from":"2026-08-18","release_version":"1.5.0","review_due_on":"2027-08-18","supersedes":"AI_Governance_Global_Source_Register_v1.4.0"},"authority_boundary":"This register owns stable source identity, exact publication identity, authority tier and type, official location, edition or date, verification metadata, licensing boundary and bounded A–F coverage. It does not contain category-level clause mappings or case evidence. Category objects own exact locators, supported claims, mapping rationale, applicability and exclusions. Registration alone cannot satisfy a control, prove compliance or authorize a governance decision.","authority_tiers":[{"id":"TIER_1_NORMATIVE","meaning":"Binding legislation and primary rights instruments. A source is normative only when its jurisdictional, material, actor, role and temporal applicability conditions are established for the assessed case."},{"id":"TIER_2_AUTHORITATIVE","meaning":"Official non-binding guidance, government and intergovernmental frameworks, EU agency publications and published consensus standards. These sources support interpretation, risk management or assurance but must not be represented as legislation."},{"id":"TIER_3_SUPPORTING","meaning":"Recognized community technical guidance. These sources may support threat models, tests, examples and control design but cannot independently establish legal obligations, compliance or approval."}],"domain_coverage":[{"coverage_statement":"Covers intended purpose and use boundaries, AI suitability and proportionality, value-chain roles, risk/legal/regulatory classification, and lifecycle stage/transition boundaries.","domain":"A","minimum_source_ids":["SRC-EU-AIA","SRC-EU-AIA-OMNIBUS-2026","SRC-FI-AI-SUPERVISION-1377-2025","SRC-EU-CHARTER","SRC-OECD-AI-PRINCIPLES-2024","SRC-ISO-42001-2023","SRC-ISO-23894-2023","SRC-NIST-AI-RMF","SRC-EU-PLD-2024-2853","SRC-FI-ADMIN-LAW-434-2003","SRC-EC-AIA-PROHIBITED-GUIDELINES-2025","SRC-ISO-42005-2025"],"title":"Purpose, value, context, roles and classification"},{"coverage_statement":"Covers data inventory/provenance/lineage, purpose limitation and minimisation, privacy and data-subject rights, confidentiality boundaries, and IP/licensing/content rights.","domain":"B","minimum_source_ids":["SRC-EU-GDPR-2016-679","SRC-FI-DPA-1050-2018","SRC-EU-DATA-ACT-2023-2854","SRC-EU-EPRIVACY-2002-58","SRC-EU-LED-2016-680","SRC-FI-PRIVACY-WORK-759-2004","SRC-EU-AIA","SRC-EDPB-OPINION-28-2024","SRC-ISO-27701-2025","SRC-EU-COPYRIGHT-DSM-2019-790","SRC-FI-COPYRIGHT-404-1961","SRC-EU-TRADE-SECRETS-2016-943","SRC-NIST-PRIVACY-FRAMEWORK"],"title":"Data, privacy, confidentiality and intellectual property"},{"coverage_statement":"Covers model/agent/component inventory, model and provider suitability, agent autonomy and tool permissioning, provider/vendor contractual governance, and AI supply-chain integrity and change control.","domain":"C","minimum_source_ids":["SRC-EU-AIA","SRC-EU-CRA-2024-2847","SRC-EU-NIS2-2022-2555","SRC-ISO-42001-2023","SRC-NIST-SP-800-218A","SRC-OWASP-LLM-TOP10","SRC-OWASP-AGENTIC-TOP10-2026","SRC-ENISA-AI-CYBER","SRC-NCSC-CISA-SECURE-AI","SRC-ISO-27036-3-2023","SRC-EU-DSA-2022-2065","SRC-FI-AI-SUPERVISION-1377-2025"],"title":"Models, agents, providers, tools and supply chain"},{"coverage_statement":"Covers secure and isolated architecture, functional quality/accuracy/reliability, AI-specific security and adversarial resilience, traceability/reproducibility/observability, and safety/failure handling and recovery.","domain":"D","minimum_source_ids":["SRC-EU-AIA","SRC-EU-CRA-2024-2847","SRC-NIST-AI-100-2E2025","SRC-ENISA-AI-CYBER","SRC-ENISA-FRONTIER-AI-2026","SRC-OWASP-LLM-TOP10","SRC-ISO-27001-2022","SRC-NIST-SP-800-218A","SRC-NCSC-CISA-SECURE-AI","SRC-ISO-42001-2023","SRC-EU-RADIO-2014-53"],"title":"Architecture, security, robustness, safety and evaluation"},{"coverage_statement":"Covers human and fundamental-rights impact, fairness and non-discrimination, transparency and communication, meaningful human oversight, and contestability/correction/accessibility/AI literacy.","domain":"E","minimum_source_ids":["SRC-EU-CHARTER","SRC-EU-AIA","SRC-EU-GDPR-2016-679","SRC-EU-EQUALITY-2000-43","SRC-EU-EQUALITY-2000-78","SRC-FI-NON-DISCRIM-1325-2014","SRC-OECD-AI-PRINCIPLES-2024","SRC-EDPB-OPINION-28-2024","SRC-ISO-42001-2023","SRC-EU-ACCESSIBILITY-2019-882","SRC-FI-ADMIN-LAW-434-2003","SRC-OHCHR-AHRC-48-31","SRC-ISO-42005-2025"],"title":"Human impact, rights, fairness, transparency, oversight and recourse"},{"coverage_statement":"Covers ownership and accountable operating model, compliance evidence and documentation integrity, risk/control/residual-risk management, decision rights/authorization/escalation, and monitoring/incidents/change/re-evaluation/retirement.","domain":"F","minimum_source_ids":["SRC-EU-AIA","SRC-ISO-42001-2023","SRC-ISO-23894-2023","SRC-NIST-AI-RMF","SRC-EU-PLD-2024-2853","SRC-FI-AI-SUPERVISION-1377-2025","SRC-FI-INFORMATION-MGMT-906-2019","SRC-OECD-AI-PRINCIPLES-2024","SRC-ISO-31000-2018","SRC-EU-GDPR-2016-679","SRC-ENISA-AI-CYBER","SRC-NIST-SP-800-53","SRC-ISO-42005-2025"],"title":"Accountability, evidence, risk decisions and lifecycle governance"}],"register_id":"AI-GOV-SOURCE-REGISTER","release_status":"APPROVED","schema_version":"2.1.0","sources":[{"authority_tier":"TIER_2_AUTHORITATIVE","authority_type":"OFFICIAL_NON_BINDING_GUIDANCE","domain_coverage":["A"],"effective_status":"PUBLISHED","id":"SRC-EC-AIA-PROHIBITED-GUIDELINES-2025","jurisdictions":["EU"],"last_verified_date":"2026-08-18","licensing_storage_boundary":"Store official metadata and permitted content subject to publisher terms.","official_location":"https://digital-strategy.ec.europa.eu/en/library/commission-publishes-guidelines-prohibited-artificial-intelligence-ai-practices-defined-ai-act","roles_or_applicability_conditions":["Non-binding Commission interpretation of Article 5; apply case-by-case and do not present it as legislation or as overriding authoritative interpretation by the Court of Justice of the European Union."],"supersedes_source_id":null,"title":"Commission Guidelines on prohibited artificial intelligence practices established by Regulation (EU) 2024/1689 (AI Act)","verification_status":"VERIFIED","version_or_date":"C(2025) 5052 final, 29 July 2025"},{"authority_tier":"TIER_2_AUTHORITATIVE","authority_type":"OFFICIAL_NON_BINDING_GUIDANCE","domain_coverage":["B","E"],"effective_status":"PUBLISHED","id":"SRC-EDPB-OPINION-28-2024","jurisdictions":["EU"],"last_verified_date":"2026-08-18","licensing_storage_boundary":"Store official metadata and permitted content subject to publisher terms.","official_location":"https://www.edpb.europa.eu/documents/opinion-of-the-board-art-64/opinion-282024-on-certain-data-protection-aspects-related-to_en","roles_or_applicability_conditions":["Article 64(2) opinion addressing anonymity of AI models, legitimate interests and consequences of unlawful personal-data processing during model development.","Apply the GDPR case-by-case; the opinion does not establish that every AI model contains personal data or that a particular processing operation is lawful."],"supersedes_source_id":null,"title":"EDPB Opinion 28/2024 on certain data protection aspects related to the processing of personal data in the context of AI models","verification_status":"VERIFIED","version_or_date":"Opinion 28/2024, adopted 17 December 2024; p